#!expect=mass_storage
#!ground_truth=tester_identified
#!device=Samsung feature phone, mass-storage-only mode
#!tester=Rana
#!promoted=hand-set 30 Aug. Ranaji confirmed this is the SAME physical phone as
#!promoted=04e8-6845 in a different USB mode. One device, two product IDs, two
#!promoted=classes -- the case device_local_id exists for.
#!note=Its record carried identity_source=unidentified because of the console bug
#!note=fixed on 30 Aug, so it could not be promoted automatically.
#!adb_state=none
#!captured=20260830-002221

Bus 001 Device 019: ID 04e8:675a Samsung Electronics Co., Ltd D900e/B2100 Mass Storage
Negotiated speed: High Speed (480Mbps)
Device Descriptor:
  bLength                18
  bDescriptorType         1
  bcdUSB               2.00
  bDeviceClass            2 Communications
  bDeviceSubClass         0 [unknown]
  bDeviceProtocol         0 
  bMaxPacketSize0        64
  idVendor           0x04e8 Samsung Electronics Co., Ltd
  idProduct          0x675a D900e/B2100 Mass Storage
  bcdDevice            4.00
  iManufacturer           1 Samsung
  iProduct                2 SAMSUNG Mobile Device
  bNumConfigurations      1
  Configuration Descriptor:
    bLength                 9
    bDescriptorType         2
    wTotalLength       0x0020
    bNumInterfaces          1
    bConfigurationValue     2
    iConfiguration          0 
    bmAttributes         0xc0
      Self Powered
    MaxPower              500mA
    Interface Descriptor:
      bLength                 9
      bDescriptorType         4
      bInterfaceNumber        0
      bAlternateSetting       0
      bNumEndpoints           2
      bInterfaceClass         8 Mass Storage
      bInterfaceSubClass      6 SCSI
      bInterfaceProtocol     80 Bulk-Only
      iInterface              5 Samsung Mass Storage Device
      Endpoint Descriptor:
        bLength                 7
        bDescriptorType         5
        bEndpointAddress     0x01  EP 1 OUT
        bmAttributes            2
          Transfer Type            Bulk
          Synch Type               None
          Usage Type               Data
        wMaxPacketSize     0x0200  1x 512 bytes
        bInterval               0
      Endpoint Descriptor:
        bLength                 7
        bDescriptorType         5
        bEndpointAddress     0x81  EP 1 IN
        bmAttributes            2
          Transfer Type            Bulk
          Synch Type               None
          Usage Type               Data
        wMaxPacketSize     0x0200  1x 512 bytes
        bInterval               0
Device Qualifier (for other device speed):
  bLength                10
  bDescriptorType         6
  bcdUSB               2.00
  bDeviceClass            2 Communications
  bDeviceSubClass         0 [unknown]
  bDeviceProtocol         0 
  bMaxPacketSize0        64
  bNumConfigurations      6
Device Status:     0x0000
  (Bus Powered)
